Movie_title,Category
Who's Harry Kellerman and Why Is He Saying Those Terrible Things About Me?,Comedy
Master@ and Commander: The Far Side of the World,Drama
"Pirates, of 25 the Caribbean: The Curse of the Black Pearl",Adventure
The Man    Who Knew Too Much,Drama
The   Englishman Who Went Up a Hill But Came Down a Mountain,Comedy 
https://www.bbc.com/news Shoot First and Pray You're Living (Because Luck Has Nothing to Do with It),Adventure
And When Did! You Last See Your Father?,Drama 
Why Get  Married the Day the World Ends?,Comedy
Someday 400 This Pain Will Be Useful to # You,Drama
Those Magnificent Men in Their Flying Machines,Adventure
